,tweet-id,tweet-text,include-links,tweet-url
681,780242223405211653,"Will join the @CSIR_IND Platinum Jubilee Celebrations, where I will release seven new plant varieties developed at CSIR laboratories.",,https://twitter.com/narendramodi/status/780242223405211653
682,780241518577582080,Warm birthday wishes to Dr. Manmohan Singh ji. May God bless him with a long and healthy life.,,https://twitter.com/narendramodi/status/780241518577582080
683,780085762075205632,"Reiterated BJP's commitment to 'Sabka Saath, Sabka Vikas' & our focus of all round & inclusive development.",http://nm-4.com/kf5w,https://twitter.com/narendramodi/status/780085762075205632
684,780085345673093120,Shared my thoughts on the BJP's ideological commitment to serving the poorest of the poor at the Deendayal Upadhyaya centenary celebrations.,,https://twitter.com/narendramodi/status/780085345673093120
685,779941057471524864,Some pictures from the BJP National Council meeting in Kozhikode. @BJP4India,,https://twitter.com/narendramodi/status/779941057471524864
686,779940363582582784,Had a very good interaction with the guest house staff in Kozhikode. Thanked them for their hospitality.,,https://twitter.com/narendramodi/status/779940363582582784
687,779939494984241152,"Spoke on Uri, 2 years of Swachh Bharat Mission, #Paralympics &amp; 2 years of #MannKiBaat during the programme today.",https://soundcloud.com/narendramodi/pm-modis-mann-ki-baat-september-2016,https://twitter.com/narendramodi/status/779939494984241152
688,779939243476918272,Had several interactions with Pujya Vijay Premsurishwarji Maharaj Sahab. Here is my speech from a programme in 2012.,https://www.youtube.com/watch?v=ZGG9r0cy1fI,https://twitter.com/narendramodi/status/779939243476918272
689,779939068549279744,My thoughts & prayers are with the countless followers of Pujya Vijay Premsurishwarji Maharaj Sahab.,,https://twitter.com/narendramodi/status/779939068549279744
690,779938572279308288,"My tributes to the divine soul, Pujya Vijay Premsurishwarji Maharaj Sahab, who selflessly served society for years.",,https://twitter.com/narendramodi/status/779938572279308288
691,779938024939335680,Prayed at the Sreekanteswara Temple today morning.,,https://twitter.com/narendramodi/status/779938024939335680
692,779860795400163328,"पंडित दीनदयाल उपाध्याय जी की जन्म जयंती पर उनको शत् शत् नमन। We salute our inspiration, Pandit Deendayal Upadhyaya on his birth anniversary.",,https://twitter.com/narendramodi/status/779860795400163328
693,779715981916667904,Do join #MannKiBaat tomorrow.,,https://twitter.com/narendramodi/status/779715981916667904
694,779690991083073536,"हमारा देश - गरीबी से मुक्त, समृद्धि से युक्त, अन्याय से मुक्त, न्याय से युक्त, गंदगी से मुक्त, स्वच्छता से युक्त हो। #TransformingIndia",,https://twitter.com/narendramodi/status/779690991083073536
695,779690808224063488,125 करोड़ देशवासियों का मनोबल हमारी ताकत है।,,https://twitter.com/narendramodi/status/779690808224063488
696,779690689445568514,Saluting @BJP4Keralam Karyakartas for their determination &amp; perseverance.,,https://twitter.com/narendramodi/status/779690689445568514
697,779683898858938368,Sharing my speech at the public meeting in Kozhikode. http://nm-4.com/iu3w,http://nm-4.com/iu3w,https://twitter.com/narendramodi/status/779683898858938368
698,779683084610342912,Thank you Kozhikode. The public meeting today was memorable. Here are some pictures.,,https://twitter.com/narendramodi/status/779683084610342912
699,779627234260717568,Will address a public meeting in Kozhikode later this evening. Do join. http://www.narendramodi.in/watch-live,http://www.narendramodi.in/watch-live,https://twitter.com/narendramodi/status/779627234260717568
700,778971003724500994,Happy to meet you @DeepaAthlete. The entire nation salutes you for your achievements.,,https://twitter.com/narendramodi/status/778971003724500994
701,778970733670051840,"With the champion, @DevJhajharia. We can learn a lot from his life &amp; determination.",,https://twitter.com/narendramodi/status/778970733670051840
702,778970578275348482,Mariyappan Thangavelu has captured India’s imagination. Delighted to meet him.,,https://twitter.com/narendramodi/status/778970578275348482
703,778970385924497408,Varun Singh Bhati is a superb athlete. Was great to learn about his experiences at the #Paralympics.,,https://twitter.com/narendramodi/status/778970385924497408
704,778969991689277441,With the talented club thrower Dharambir.,,https://twitter.com/narendramodi/status/778969991689277441
705,778969468043079680,Virender is a national champion & has won laurels in tournaments worldwide.,,https://twitter.com/narendramodi/status/778969468043079680
706,778969303668301825,Suyash Jadhav is an ace swimmer and has secured laurels in many tournaments.,,https://twitter.com/narendramodi/status/778969303668301825
707,778969083274338306,"With Sharad Kumar, who represented India in high jump at the #Paralympics.",,https://twitter.com/narendramodi/status/778969083274338306
708,778968826369060865,"With Sandeep, a talented javelin thrower. Congratulations for his efforts.",,https://twitter.com/narendramodi/status/778968826369060865
709,778968608714010625,Javelin thrower Rinku & I interacted earlier today. Admire his passion & determination to shine.,,https://twitter.com/narendramodi/status/778968608714010625
710,778968362202255360,I applaud Rampal Chahar for his passion and devotion to sports.,,https://twitter.com/narendramodi/status/778968362202255360
711,778968093628391424,"With Pooja, who has excelled in archery and represented India at the #Paralympics.",,https://twitter.com/narendramodi/status/778968093628391424
712,778967868767469568,Shooter Naresh Kumar Sharma has represented India in many tournaments. Very proud of him.,,https://twitter.com/narendramodi/status/778967868767469568
713,778967559278174208,Narender is a javelin thrower. He faced obstacles but that never deterred him from pursuing sports with dedication.,,https://twitter.com/narendramodi/status/778967559278174208
714,778967267870584833,Karam Jyoti is a widely admired discus thrower.,,https://twitter.com/narendramodi/status/778967267870584833
715,778966962080653316,"Utmost commitment & resolve ensured Farman Basha overcame tragedy, did well in powerlifting & made India proud.",,https://twitter.com/narendramodi/status/778966962080653316
716,778966491223822336,"With Ankur Dhama, who represented India in 1500m race at the #Paralympics.",,https://twitter.com/narendramodi/status/778966491223822336
717,778966103049383937,"Excellent discussions with Amit Kumar, who represented India in club throw and discus throw.",,https://twitter.com/narendramodi/status/778966103049383937
718,778947239188140032,With the medal winners. Kudos to their efforts & accomplishments.,,https://twitter.com/narendramodi/status/778947239188140032
719,778947010539851776,It was a delight to meet the Indian contingent that made our nation proud at the #Paralympics. #Rio2016,,https://twitter.com/narendramodi/status/778947010539851776
720,778594353384034305,A decision that will give an impetus to development of eastern India & ensure availability of eco-friendly fuel.,http://nm-4.com/snzw,https://twitter.com/narendramodi/status/778594353384034305
721,778593905377841156,"Discussed holistic development of islands in sectors like infrastructure, tourism, agriculture & other sectors.",http://nm-4.com/pnzw,https://twitter.com/narendramodi/status/778593905377841156
722,777417540976926725,Have spoken to HM & RM on the situation. RM will go to J&K himself to take stock of the situation.,,https://twitter.com/narendramodi/status/777417540976926725
723,777417419203706880,We salute all those martyred in Uri. Their service to the nation will always be remembered. My thoughts are with the bereaved families.,,https://twitter.com/narendramodi/status/777417419203706880
724,777417302912430080,We strongly condemn the cowardly terror attack in Uri. I assure the nation that those behind this despicable attack will not go unpunished.,,https://twitter.com/narendramodi/status/777417302912430080
725,777194382319464449,Congratulations to all those who took part in various noble deeds of social service across the nation & contributed towards nation building.,,https://twitter.com/narendramodi/status/777194382319464449
726,777194023765221376,I have not been able to personally reply to so many people. Am very humbled by the affection received.,,https://twitter.com/narendramodi/status/777194023765221376
727,777193750661435392,Today friends from all over India & across the world extended birthday greetings. I profusely thank each & every person who wished.,,https://twitter.com/narendramodi/status/777193750661435392
728,777189409712025600,Thanks Jack. Twitter is a great place to interact.,https://twitter.com/jack/status/777177842056515584,https://twitter.com/narendramodi/status/777189409712025600
729,777175674784063488,Thanks.,,https://twitter.com/narendramodi/status/777175674784063488
730,777175631419224064,Thank you very much.,,https://twitter.com/narendramodi/status/777175631419224064
731,777175561974099974,Thank you.,,https://twitter.com/narendramodi/status/777175561974099974
732,777175451286409217,Thanks for the wishes.,,https://twitter.com/narendramodi/status/777175451286409217
733,777175064814850048,धन्यवाद,,https://twitter.com/narendramodi/status/777175064814850048
734,777174983864745984,Thanks a lot.,,https://twitter.com/narendramodi/status/777174983864745984
735,777174903896190976,Thank you for your wishes.,,https://twitter.com/narendramodi/status/777174903896190976
736,777174784085856257,Thanks for the greetings.,,https://twitter.com/narendramodi/status/777174784085856257
737,777174737428426752,Thanks.,,https://twitter.com/narendramodi/status/777174737428426752
738,777174648425369600,Thank you for the very kind birthday wishes.,https://twitter.com/Pvsindhu1/status/777160409002315780,https://twitter.com/narendramodi/status/777174648425369600
739,777174183394410497,धन्यवाद मनोज,https://twitter.com/manojsirsa/status/776856443140075521,https://twitter.com/narendramodi/status/777174183394410497
740,777174028444274689,Very kind of you to extend birthday wishes. Thanks.,https://twitter.com/deveshnayak/status/776856560559611904,https://twitter.com/narendramodi/status/777174028444274689
741,777173809535160321,Gratitude for the birthday wishes.,https://twitter.com/SumonChakraVIEW/status/777001812788293632,https://twitter.com/narendramodi/status/777173809535160321
742,777173655960694784,Thanks a lot.,https://twitter.com/premshriname/status/777030762998607872,https://twitter.com/narendramodi/status/777173655960694784
743,777173427316666368,बहुत बहुत धन्यवाद,https://twitter.com/manu_bajaj/status/777038709329764353,https://twitter.com/narendramodi/status/777173427316666368
744,777172222997770240,Thank you Vijay Bhai.,https://twitter.com/vijayrupanibjp/status/776972454556303361,https://twitter.com/narendramodi/status/777172222997770240
745,777171763075571712,बहुत बहुत धन्यवाद शिवराज जी।,https://twitter.com/ChouhanShivraj/status/776850765654601728,https://twitter.com/narendramodi/status/777171763075571712
746,777171542283128832,"Amit Bhai, thanks for the birthday wishes.",https://twitter.com/AmitShah/status/776983675640492032,https://twitter.com/narendramodi/status/777171542283128832
747,777171361135329280,सत्यार्थी जी आपकी मंगलकामनाओं के लिए बहुत बहुत धन्यवाद।,https://twitter.com/k_satyarthi/status/777102349374484480,https://twitter.com/narendramodi/status/777171361135329280
748,777170627861983232,Thanks for the birthday wishes.,https://twitter.com/CMPemaKhandu/status/776960305385451521,https://twitter.com/narendramodi/status/777170627861983232
749,777170420109750272,Thank you CM Chamling.,https://twitter.com/pawanchamling5/status/776988661489336321,https://twitter.com/narendramodi/status/777170420109750272
750,777170204811931648,Thanks Dr. Raman Singh.,https://twitter.com/drramansingh/status/776956593883590656,https://twitter.com/narendramodi/status/777170204811931648
751,777170088831004672,Thank you so much for the wishes.,https://twitter.com/Dev_Fadnavis/status/777005384439468032,https://twitter.com/narendramodi/status/777170088831004672
752,777169458309705728,"Thank you, Chief Minister Siddaramaiah.",https://twitter.com/CMofKarnataka/status/777056327747014656,https://twitter.com/narendramodi/status/777169458309705728
753,777169093958840320,My gratitude to CM KCR for the birthday wishes.,https://twitter.com/TelanganaCMO/status/777092891667595265,https://twitter.com/narendramodi/status/777169093958840320
754,777168924311818240,Thank you very much.,https://twitter.com/Naveen_Odisha/status/777001441034579968,https://twitter.com/narendramodi/status/777168924311818240
755,777168801141886976,"नीतीश जी, शुभकामनाओं के लिए धन्यवाद",https://twitter.com/NitishKumar/status/777071211213762560,https://twitter.com/narendramodi/status/777168801141886976
756,777167278110482432,"Vasundhara Ji, thank you for the birthday wishes.",https://twitter.com/VasundharaBJP/status/776942523046649856,https://twitter.com/narendramodi/status/777167278110482432
757,777167177409363968,Thank you Jaitley Ji.,https://twitter.com/arunjaitley/status/776977460894117888,https://twitter.com/narendramodi/status/777167177409363968
758,777167043799883776,Thank you for the greetings.,https://twitter.com/sureshpprabhu/status/776833831886131200,https://twitter.com/narendramodi/status/777167043799883776
759,777165878433419264,My gratitude for the birthday wishes.,https://twitter.com/tsheringtobgay/status/776997661945626624,https://twitter.com/narendramodi/status/777165878433419264
760,777148418779062274,Priceless moments from Navsari which I will never forget.,,https://twitter.com/narendramodi/status/777148418779062274
761,777148276604669954,"Highlighted how Central Government is ushering a paradigm shift & transformative changes in the lives of poor, downtrodden & marginalised.",,https://twitter.com/narendramodi/status/777148276604669954
762,777148123374194689,#DivyangMegaCamp has created history. The name of Navsari is now written in golden letters with the setting of path-breaking records.,,https://twitter.com/narendramodi/status/777148123374194689
763,777147689003646981,Spent the day with tribal & Divyang sisters & brothers. Was very satisfying & gladdening to interact with them. http://www.pmindia.gov.in/en/news_updates/pm-in-gujarat/?comment=disable,http://www.pmindia.gov.in/en/news_updates/pm-in-gujarat/?comment=disable,https://twitter.com/narendramodi/status/777147689003646981
764,777124847524515840,Thank you @SrBachchan. Your wishes have touched me.,http://www.narendramodi.in/testimonial/detail?id=69,https://twitter.com/narendramodi/status/777124847524515840
765,777124713294200832,Thank you so much @ShashiTharoor. Looking forward to the continued debate and discussion in the times to come. http://www.narendramodi.in/testimonial/detail?id=39,http://www.narendramodi.in/testimonial/detail?id=39,https://twitter.com/narendramodi/status/777124713294200832
766,777124416303923200,I thank @yogrishiramdev Ji for his wishes.,http://www.narendramodi.in/testimonial/detail?id=80,https://twitter.com/narendramodi/status/777124416303923200
767,777124209252179968,Thanks Cyrus Mistry for the wonderful greetings.,http://www.narendramodi.in/testimonial/detail?id=10,https://twitter.com/narendramodi/status/777124209252179968
768,777124122237165568,Thanks @MirzaSania for your birthday greetings.,http://www.narendramodi.in/testimonial/detail?id=43,https://twitter.com/narendramodi/status/777124122237165568
769,777123912261865472,An officer I worked with in Gujarat shared his good wishes. I thank Shri D Rajagopalan for the kind words.,http://www.narendramodi.in/testimonial/detail?id=52,https://twitter.com/narendramodi/status/777123912261865472
770,777123189289648128,आपका बहुत बहुत आभार लता दीदी। http://www.narendramodi.in/testimonial/detail?id=70 @mangeshkarlata,http://www.narendramodi.in/testimonial/detail?id=70,https://twitter.com/narendramodi/status/777123189289648128
771,777122984649601024,Gratitude for the lovely wishes @sachin_rt.,http://www.narendramodi.in/testimonial/detail?id=73,https://twitter.com/narendramodi/status/777122984649601024
772,777083590534324224,Thank you. Humbled by the kind words.,https://twitter.com/ashrafghani/status/777051787564093440,https://twitter.com/narendramodi/status/777083590534324224
773,777083283548934144,Fully agree with you! And thank you so much for your good wishes.,https://twitter.com/tim_cook/status/776980648653312000,https://twitter.com/narendramodi/status/777083283548934144
774,777083113952284673,Touched by the gesture. Thank you so much. @Varun_dvn,https://twitter.com/IndiaToday/status/777038908877975552,https://twitter.com/narendramodi/status/777083113952284673
775,777082982070824960,Thank you. Your sense of humour has always been widely admired.,https://twitter.com/Amul_Coop/status/776852810935566336,https://twitter.com/narendramodi/status/777082982070824960
776,777082653405089792,"Sehwag Ji, you are very kind. Together we have to make this India’s century & take India to new heights.",https://twitter.com/virendersehwag/status/776857220805976064,https://twitter.com/narendramodi/status/777082653405089792
777,777082501017640961,Thank you my young friend.,https://twitter.com/shivathapa/status/777014243186978816,https://twitter.com/narendramodi/status/777082501017640961
778,777077026482028544,"Thank you, Virbhadra Singh Ji.",https://twitter.com/virbhadrasingh/status/777040576004759553,https://twitter.com/narendramodi/status/777077026482028544
779,777076790745411584,"Thank you, Bandaru Ji.",https://twitter.com/Dattatreya/status/776988668892327937,https://twitter.com/narendramodi/status/777076790745411584
780,777076579973275648,Gratitude for the greetings.,https://twitter.com/Rao_InderjitS/status/776984095154810880,https://twitter.com/narendramodi/status/777076579973275648
781,777076352214151168,धन्यवाद विजय जी,https://twitter.com/VijayGoelBJP/status/776971465195331584,https://twitter.com/narendramodi/status/777076352214151168
782,777076248350601216,Thanks Dr. Singh.,https://twitter.com/DrJitendraSingh/status/777025912357347331,https://twitter.com/narendramodi/status/777076248350601216
783,777076010386792448,Thank you for your wishes.,https://twitter.com/nsitharaman/status/776868338517487616,https://twitter.com/narendramodi/status/777076010386792448
784,777075869412052992,"महेश जी, आपकी शुभकामनाओं के लिए आभार",https://twitter.com/dr_maheshsharma/status/776979853027348485,https://twitter.com/narendramodi/status/777075869412052992
785,777075777447665664,धन्यवाद राजीव जी,https://twitter.com/RajivPratapRudy/status/777002395406479360,https://twitter.com/narendramodi/status/777075777447665664
786,777075123522121728,I thank you for the good wishes.,https://twitter.com/dpradhanbjp/status/776863676947111936,https://twitter.com/narendramodi/status/777075123522121728
787,777074966030274561,"Piyush Ji, thank you very much.",https://twitter.com/piyushgoyal/status/777065664464945152,https://twitter.com/narendramodi/status/777074966030274561
788,777074754117218304,Thank you.,https://twitter.com/prakashjavdekar/status/777002352792309761,https://twitter.com/narendramodi/status/777074754117218304
789,777074616971857920,Thank you very much for your wishes.,https://twitter.com/smritiirani/status/776985233992417281,https://twitter.com/narendramodi/status/777074616971857920
790,777074421131386880,Gratitude for the birthday greetings.,https://twitter.com/drharshvardhan/status/776886730502893568,https://twitter.com/narendramodi/status/777074421131386880
791,777074275693899776,I thank you for your wishes.,https://twitter.com/jpnadda/status/776853371164602368,https://twitter.com/narendramodi/status/777074275693899776
792,777043203807518720,Gratitude for the wishes.,https://twitter.com/TCGEHLOT/status/776985886076575744,https://twitter.com/narendramodi/status/777043203807518720
793,777041921642418177,Thank you very much.,https://twitter.com/ChBirenderSingh/status/776982842521759744,https://twitter.com/narendramodi/status/777041921642418177
794,777040189449314305,धन्यवाद राधा मोहन जी,https://twitter.com/RadhamohanBJP/status/776958773806018560,https://twitter.com/narendramodi/status/777040189449314305
795,777039353340006400,शुभकामनाओं के लिए धन्यवाद नरेंद्र सिंह तोमर जी,https://twitter.com/nstomar/status/776956086284935168,https://twitter.com/narendramodi/status/777039353340006400
796,777038840099844096,Thank you for the good wishes.,https://twitter.com/HarsimratBadal_/status/776989100037464065,https://twitter.com/narendramodi/status/777038840099844096
797,777038434690932736,Thank you very much.,https://twitter.com/rsprasad/status/776986546855550976,https://twitter.com/narendramodi/status/777038434690932736
798,777038226204700672,"Ananth Ji, my gratitude for the greetings.",https://twitter.com/AnanthKumar_BJP/status/776972700111609856,https://twitter.com/narendramodi/status/777038226204700672
799,777038013960327168,Thank you Maneka Ji for the birthday wishes.,https://twitter.com/Manekagandhibjp/status/776986547698544640,https://twitter.com/narendramodi/status/777038013960327168
800,777037853981233152,धन्यवाद कलराज जी।,https://twitter.com/KalrajMishra/status/776974097527943171,https://twitter.com/narendramodi/status/777037853981233152
801,777037614956228608,Thank you for the wishes.,https://twitter.com/irvpaswan/status/776850701104414720,https://twitter.com/narendramodi/status/777037614956228608
802,777037495456235520,धन्यवाद उमा जी,https://twitter.com/umasribharti/status/777004050067828736,https://twitter.com/narendramodi/status/777037495456235520
803,777036574366195712,Gratitude for the good wishes.,https://twitter.com/DVSBJP/status/776930385808588800,https://twitter.com/narendramodi/status/777036574366195712
804,777036273441570816,"Nitin Ji, thank you for the birthday greetings.",https://twitter.com/nitin_gadkari/status/776999791079284736,https://twitter.com/narendramodi/status/777036273441570816
805,777036151563493376,Thanks a lot for the wishes.,https://twitter.com/MVenkaiahNaidu/status/776959993706713088,https://twitter.com/narendramodi/status/777036151563493376
806,777035925297635328,Thank you Sushma Ji.,https://twitter.com/SushmaSwaraj/status/776981219552538624,https://twitter.com/narendramodi/status/777035925297635328
807,777035767625330689,Thank you Rajnath Ji for the kind wishes.,https://twitter.com/rajnathsingh/status/776984321336840192,https://twitter.com/narendramodi/status/777035767625330689
808,777027947551010816,Thank you very much Rahul Ji.,https://twitter.com/officeofrg/status/777021047136620544,https://twitter.com/narendramodi/status/777027947551010816
809,777009488758837248,Received the blessings and birthday greetings of Advani ji during our telephone conversation. My gratitude to him.,,https://twitter.com/narendramodi/status/777009488758837248
810,776983680837296128,Met CJI Shri Thakur. I thank him for his kind wishes.,,https://twitter.com/narendramodi/status/776983680837296128
811,776983330029916160,My gratitude to Vice President Shri Hamid Ansari for his wishes.,,https://twitter.com/narendramodi/status/776983330029916160
812,776983168825987072,I thank Honourable Rashtrapati ji for his kind birthday greetings. @RashtrapatiBhvn,,https://twitter.com/narendramodi/status/776983168825987072
813,776977334654029824,"मां की ममता, मां का आशीर्वाद जीवन जीने की जड़ी-बूटी होता है।",,https://twitter.com/narendramodi/status/776977334654029824
814,776794706034368513,Very inspiring!,https://twitter.com/socialpwds/status/776790488804458496,https://twitter.com/narendramodi/status/776794706034368513
815,776776888110809089,Our deliberations today will provide strength to our economic engagement & boost people-to-people ties.,http://nm-4.com/me9v,https://twitter.com/narendramodi/status/776776888110809089
816,776776588457234432,Adding vigour to India-Nepal ties.,https://twitter.com/MEAIndia/status/776689566191198208,https://twitter.com/narendramodi/status/776776588457234432
817,776776245912621060,A significant day in India-Nepal ties! Glad to welcome PM Pushpa Kamal Dahal ‘Prachanda’ & hold talks with him.,,https://twitter.com/narendramodi/status/776776245912621060
818,776661620164403200,"I bow to the venerable Swami Sree Narayana Guru on his Jayanti. His noble thoughts, teachings & fight against injustice always inspire.",,https://twitter.com/narendramodi/status/776661620164403200
819,776424299192127488,Held extensive deliberations on GST rollout during the high level meeting.,http://nm-4.com/kw7v,https://twitter.com/narendramodi/status/776424299192127488
820,776424044295892993,Discussed India-Mauritius ties during the meeting with Minister Mr. Pravind Kumar Jugnauth.,,https://twitter.com/narendramodi/status/776424044295892993
821,776423664849780738,"Met Mr. Jay Y Lee, Vice Chairman, Samsung Electronics.",,https://twitter.com/narendramodi/status/776423664849780738
