,tweet-id,tweet-text,include-links,tweet-url
1405,751423120083283968,"At India-South Africa Business Meet, shared my thoughts about the need for greater India-SA economic cooperation.",http://nm-4.com/vgis,https://twitter.com/narendramodi/status/751423120083283968
1406,751422782047739908,Deputy President Mr. Cyril Ramaphosa & I met and discussed India-South Africa ties.,,https://twitter.com/narendramodi/status/751422782047739908
1407,751369779718553601,My remarks at the joint press meet with President Zuma. @PresidencyZA @SAPresident,http://nm-4.com/71hs,https://twitter.com/narendramodi/status/751369779718553601
1408,751368238848770049,Fruitful meeting with @SAPresident. We had extensive talks on enhancing India-SA cooperation. @PresidencyZA.,,https://twitter.com/narendramodi/status/751368238848770049
1409,751366642219814912,"Here are some pictures from the ceremonial welcome at the Union Buildings, Pretoria. @PresidencyZA @SAPresident",,https://twitter.com/narendramodi/status/751366642219814912
1410,751098865928069121,Saindo de Moçambique com imensa felicidade.Os sectores cobertos durante a minha visita vão fortificar o coperaçao entre a Índia e Moçambique,,https://twitter.com/narendramodi/status/751098865928069121
1411,751098378742882304,Always a delight to meet and interact with the Indian community.,,https://twitter.com/narendramodi/status/751098378742882304
1412,751087583669649409,"CITD is doing commendable work in harnessing skills of youngsters & providing a conducive atmosphere for research, innovation & start-ups.",,https://twitter.com/narendramodi/status/751087583669649409
1413,751087500005965824,"Impressive interaction with students of Mozambique at CITD, S&T Park at Maluana.",,https://twitter.com/narendramodi/status/751087500005965824
1414,751081801863409664,"Visited the National Assembly of Mozambique & met the National Assembly President, Veronica Macamo.",,https://twitter.com/narendramodi/status/751081801863409664
1415,751005798604562433,Both of us agreed that terrorism is the gravest threat facing the world today. We have decided to strengthen defence & security ties.,,https://twitter.com/narendramodi/status/751005798604562433
1416,751005668069347328,"President Nyusi & I agreed to increase cooperation in vital areas like agriculture, food security & healthcare. http://nm-4.com/tohs",http://nm-4.com/tohs,https://twitter.com/narendramodi/status/751005668069347328
1417,751005197699211264,India & Mozambique compliment each other. We have robust economic ties & this is highly beneficial for our citizens.,,https://twitter.com/narendramodi/status/751005197699211264
1418,751004375569473536,President Nyusi & I held detailed discussions on a stronger India-Mozambique partnership in the years ahead.,,https://twitter.com/narendramodi/status/751004375569473536
1419,750905810226556928,"Iniciando o meu périplo por África com uma visita a Moçambique, que vai reforçar os laços da Índia com Moçambique.",,https://twitter.com/narendramodi/status/750905810226556928
1420,750677218079244290,"Spoke to President Rouhani, President Ghani, PM Nawaz Sharif, PM Sheikh Hasina & President Yameen and greeted them on Eid.",,https://twitter.com/narendramodi/status/750677218079244290
1421,750677028274368513,"Extended Eid greetings to HM King Salman, HH the Crown Prince of Abu Dhabi, HH the Emir of Qatar.",,https://twitter.com/narendramodi/status/750677028274368513
1422,750676924880609281,My greetings and best wishes on Eid-ul-Fitr. May this special day deepen the spirit of harmony and peace in society.,,https://twitter.com/narendramodi/status/750676924880609281
1423,750641318255353856,A farmer friendly initiative for #TransformingIndia. http://www.narendramodi.in/category/infographics via NMApp,http://www.narendramodi.in/category/infographics,https://twitter.com/narendramodi/status/750641318255353856
1424,750640535212261376,Inviting you to share ideas via the Mobile App for my speeches at the community programmes in Johannesburg & Nairobi,http://nm4.in/dnldapp,https://twitter.com/narendramodi/status/750640535212261376
1425,750640289510023168,"Talks with President @UKenyatta, deliberations on economic &amp; people-to-people ties will be focus of my Kenya visit. https://www.facebook.com/narendramodi/photos/a.10150164299700165.421791.177526890164/10157219129645165/?type=3&amp;theater",https://www.facebook.com/narendramodi/photos/a.10150164299700165.421791.177526890164/10157219129645165/?type=3&theater,https://twitter.com/narendramodi/status/750640289510023168
1426,750640161990578180,"In Tanzania I will hold talks with President Dr. John Magufuli, meet ‘Solar Mamas’ & interact with Indian community. https://www.facebook.com/narendramodi/photos/a.10150164299700165.421791.177526890164/10157219121060165/?type=3&amp;theater",https://www.facebook.com/narendramodi/photos/a.10150164299700165.421791.177526890164/10157219121060165/?type=3&theater,https://twitter.com/narendramodi/status/750640161990578180
1427,750639868607401984,"My programmes in South Africa will span across Pretoria, Johannesburg, Durban & Pietermaritzburg. Here are details. https://www.facebook.com/narendramodi/photos/a.10150164299700165.421791.177526890164/10157219106520165/?type=3&amp;theater",https://www.facebook.com/narendramodi/photos/a.10150164299700165.421791.177526890164/10157219106520165/?type=3&theater,https://twitter.com/narendramodi/status/750639868607401984
1428,750639556093939712,"My Africa tour, aimed at enhancing ties between India & Africa will begin from Mozambique in a brief but key visit. https://www.facebook.com/narendramodi/photos/a.10150164299700165.421791.177526890164/10157219102250165/?type=3&amp;theater",https://www.facebook.com/narendramodi/photos/a.10150164299700165.421791.177526890164/10157219102250165/?type=3&theater,https://twitter.com/narendramodi/status/750639556093939712
1429,750580454563188737,Paid tributes to Dr. Syama Prasad Mookerjee at Parliament House.,,https://twitter.com/narendramodi/status/750580454563188737
1430,750526897759592448,"On Kutchi New Year, the auspicious occasion of Ashadhi Bij, greetings to those celebrating. Praying for a year filled with joy & prosperity.",,https://twitter.com/narendramodi/status/750526897759592448
1431,750514261999235072,"On his birth anniversary, my tributes to Dr. Syama Prasad Mookerjee. We remember with pride his rich contribution towards India’s history.",,https://twitter.com/narendramodi/status/750514261999235072
1432,750513545637294080,I bow to the great Babu Jagjivan Ram ji on his Punya Tithi. He constantly worked for the welfare of the underprivileged & marginalised.,,https://twitter.com/narendramodi/status/750513545637294080
1433,750512742323228672,"May the blessings of Lord Jagannath lead to development of villages, well-being of poor & farmers and take India to new heights of progress.",,https://twitter.com/narendramodi/status/750512742323228672
1434,750512594994147329,"On the occasion of Rath Yatra, my warmest greetings to you all. May Lord Jagannath continue to shower his blessings on everyone.",,https://twitter.com/narendramodi/status/750512594994147329
1435,750330418642182144,सफाई अभियान को दें सहयोग और स्वछ एवं सुंदर शहर का सपना करें साकार। #MyCleanIndia,,https://twitter.com/narendramodi/status/750330418642182144
1436,750329425938579456,Support and participate in this movement to create a Swachh Bharat. #MyCleanIndia,,https://twitter.com/narendramodi/status/750329425938579456
1437,750328952573624320,An interesting quiz on India & Africa…how many can you get right? https://quiz.mygov.in,https://quiz.mygov.in,https://twitter.com/narendramodi/status/750328952573624320
1438,750268409351442432,Meeting newly sworn-in colleagues at South Block. https://www.instagram.com/p/BHea5HsAd0f/,https://www.instagram.com/p/BHea5HsAd0f/,https://twitter.com/narendramodi/status/750268409351442432
1439,750237546312007680,Congrats to newly sworn-in colleagues. Lets work together to bring a positive difference & for #TransformingIndia.,,https://twitter.com/narendramodi/status/750237546312007680
1440,750174916066979840,Birthday greetings to @irvpaswan ji. May he be blessed with a long and healthy life.,,https://twitter.com/narendramodi/status/750174916066979840
1441,749974092783185920,"Each athlete has worked very hard to get here. As a nation, we are proud of what they achieved & extend our best wishes for Rio. @Rio2016_en",,https://twitter.com/narendramodi/status/749974092783185920
1442,749973919059378176,Some athletes could not attend today...I convey my best wishes to them.,,https://twitter.com/narendramodi/status/749973919059378176
1443,749971333233123329,Soumyajit Ghosh is an experienced table tennis player who even took part in London 2012. Good luck for Rio.,,https://twitter.com/narendramodi/status/749971333233123329
1444,749970745674039296,Mairaj Ahmed Khan is fully prepared for the 2016 Olympics. Best wishes to this shooter.,,https://twitter.com/narendramodi/status/749970745674039296
1445,749969345128828928,The mighty Sandeep Tomar is all set to wrestle it out in Rio. Do well my friend.,,https://twitter.com/narendramodi/status/749969345128828928
1446,749969142338449409,Narsingh Yadav is very excited to prove his mettle at the Olympics. I am sure he is going to shine.,,https://twitter.com/narendramodi/status/749969142338449409
1447,749968798858506240,Good luck to my wrestler friend Hardeep Singh. My interaction with him was very positive. Best wishes to him.,,https://twitter.com/narendramodi/status/749968798858506240
1448,749968419408207873,"Does he need any introduction? Admired by every Indian, feared by opponents, he is prepared for Rio. @DuttYogi",,https://twitter.com/narendramodi/status/749968419408207873
1449,749967950828957696,"Good wishes to you, @phogat_vinesh for the 2016 Rio Olympics.",,https://twitter.com/narendramodi/status/749967950828957696
1450,749967676425048064,Admirable preparation by wrestler Sakshi Malik for the Rio Olympics. My best wishes are with her.,,https://twitter.com/narendramodi/status/749967676425048064
1451,749966823425241092,Best of luck to hockey player Rani for the Rio games.,,https://twitter.com/narendramodi/status/749966823425241092
1452,749966308037521409,Hockey & Ritu Rani are inseparable. Best wishes to her for the games.,,https://twitter.com/narendramodi/status/749966308037521409
1453,749965995637374981,Discussed the upcoming Rio Olympics and wished H Lal Ruat Feli the best for the hockey games.,,https://twitter.com/narendramodi/status/749965995637374981
1454,749965169514733568,All the best Vandana for the 2016 Olympic games.,,https://twitter.com/narendramodi/status/749965169514733568
1455,749964847169822720,Met Poonam Rani and expressed my good wishes to her for the games.,,https://twitter.com/narendramodi/status/749964847169822720
1456,749964641967759360,"Lilima, a hockey player is very excited about representing India in 2016 Olympics. Best of luck to her.",,https://twitter.com/narendramodi/status/749964641967759360
1457,749964413692702720,Hockey player Deep Grace and I had a great chat. Good luck to her.,,https://twitter.com/narendramodi/status/749964413692702720
1458,749964132116525056,Yogita and I had a wonderful interaction. She is looking forward to representing the nation at the games.,,https://twitter.com/narendramodi/status/749964132116525056
1459,749963917812793345,Conveyed good wishes to Savita for the Rio games.,,https://twitter.com/narendramodi/status/749963917812793345
1460,749963404656386048,"Navjot Kaur, the entire nation wishes you all the best. Play well.",,https://twitter.com/narendramodi/status/749963404656386048
1461,749963151194611712,Best of luck to hockey player Jaspreet Kaur for the Olympics.,,https://twitter.com/narendramodi/status/749963151194611712
1462,749962595176775680,Met Sunita and spoke to her about the games and wished her best of luck.,,https://twitter.com/narendramodi/status/749962595176775680
1463,749962250245505024,All the best Renuka! I am sure you and your team will put up a good fight at the 2016 Olympics.,,https://twitter.com/narendramodi/status/749962250245505024
1464,749961929834266624,"Good luck to you, Punam.",,https://twitter.com/narendramodi/status/749961929834266624
1465,749961799747895296,"Meet the talented hockey player Nikki, who will represent India at the 2016 Olympics. Good luck.",,https://twitter.com/narendramodi/status/749961799747895296
1466,749961222427176960,Talked about the upcoming Olympics with hockey player Namita. Wished her all the best.,,https://twitter.com/narendramodi/status/749961222427176960
1467,749960319104057344,Wished hockey player Anuradha Devi the very best for the Olympics.,,https://twitter.com/narendramodi/status/749960319104057344
1468,749960008427827200,All the best Sonika for the games in Rio.,,https://twitter.com/narendramodi/status/749960008427827200
1469,749959928685748224,"With hockey player Preeti, wishing her for 2016 games.",,https://twitter.com/narendramodi/status/749959928685748224
1470,749959513231466496,Sushila Chanu and I had a chat on the Olympic games and I extended my good wishes to her.,,https://twitter.com/narendramodi/status/749959513231466496
1471,749959101543776256,Good luck Rajani. We will cheer for you and the hockey team when you all are on the field at Rio.,,https://twitter.com/narendramodi/status/749959101543776256
1472,749958845104005120,Do well Deepika! May you play well at Rio and make us all proud.,,https://twitter.com/narendramodi/status/749958845104005120
1473,749958389791354880,We know about the very talented Deepika Kumari. She participated in London 2012 & will again do so in Rio. Good luck,,https://twitter.com/narendramodi/status/749958389791354880
1474,749957836088696832,"Give your best at the Olympics and make India proud, @BoxerManojkr.",,https://twitter.com/narendramodi/status/749957836088696832
1475,749956793774772224,Was great meeting you @srikidambi. All the best.,,https://twitter.com/narendramodi/status/749956793774772224
1476,749955400959655936,The boxing ring at Rio awaits the exceptional @shivathapa. Good luck my young friend.,,https://twitter.com/narendramodi/status/749955400959655936
1477,749954803221065728,Atanu Das will represent India in archery. I wish him the very best.,,https://twitter.com/narendramodi/status/749954803221065728
1478,749954134632169473,"My best wishes PV Sindhu, as you embark on this important tournament. Am sure you will give your best!",,https://twitter.com/narendramodi/status/749954134632169473
1479,749953742557048833,Laxmi Rani Majhi is a part of the women's archery team. Good luck to her!,,https://twitter.com/narendramodi/status/749953742557048833
1480,749952904807735296,Gymnast Dipa Karmakar is all set to take the Olympics by storm. Conveyed my good wishes to her.,,https://twitter.com/narendramodi/status/749952904807735296
1481,749951856810528769,L Bombayla Devi’s archery skills are widely appreciated. I wish her the very best for the Olympics.,,https://twitter.com/narendramodi/status/749951856810528769
1482,749950953663696896,With marathon runner OP Jaisha. Extended my best wishes for the 2016 Olympics.,,https://twitter.com/narendramodi/status/749950953663696896
1483,749950494290874369,Delighted to meet men’s marathon runner @NrawatSingh. Wished him good luck.,,https://twitter.com/narendramodi/status/749950494290874369
1484,749949796253851648,"Inderjeet Singh is competing in the men’s shot-put. Told him to give his best, we are proud of him. @inderjeetshput",,https://twitter.com/narendramodi/status/749949796253851648
1485,749948610947735554,Chandan Singh & me spoke about his Olympic journey & I told him to give his best.,,https://twitter.com/narendramodi/status/749948610947735554
1486,749948278771417088,Met Baljinder Singh. I extended my best wishes to this athlete for his Rio journey. He also competed in London 2012.,,https://twitter.com/narendramodi/status/749948278771417088
1487,749947720169824256,Sudha Singh (Women's 3000m Steeplechase) is world number 15 & Gold medalist in Asian Games 2014. Good luck Sudha.,,https://twitter.com/narendramodi/status/749947720169824256
1488,749947245617881088,Lalita Babar (Women's 3000m Steeplechase) is enthusiastic to represent India at the Olympics. Happy to meet her.,,https://twitter.com/narendramodi/status/749947245617881088
1489,749946681685344256,Kavita Raut was a gold medalist in the South Asian Games 2016. Wished this marathon runner the very best for Rio.,,https://twitter.com/narendramodi/status/749946681685344256
1490,749946292445536260,Men’s marathon runner Gopi T is all set for the run in Rio. Told him to give his best.,,https://twitter.com/narendramodi/status/749946292445536260
1491,749945770976083968,Neeraj Rathi will take part in the men’s 20 km racewalk. I encouraged him to do well at the Olympics.,,https://twitter.com/narendramodi/status/749945770976083968
1492,749945192560599040,Kheta Ram is going to take Rio by storm! Here’s wishing the marathon runner all the best.,,https://twitter.com/narendramodi/status/749945192560599040
1493,749944517831294976,Jitu Rai is an accomplished shooter who is raring to go…expressed my good wishes to the bright shooter. @jiturai2014,,https://twitter.com/narendramodi/status/749944517831294976
1494,749943976120254465,Saw a fighting spirit in shooter Gurpreet Singh & am sure he is going to give his best for the nation at the games.,,https://twitter.com/narendramodi/status/749943976120254465
1495,749943608237756417,"He’s been there & done that before…@gaGunNarang is all set, once again for Rio. Wished him good luck.",,https://twitter.com/narendramodi/status/749943608237756417
1496,749942812423127040,"Good luck to you, @MoumaDasTT . I hope you play well at the 2016 Olympics.",,https://twitter.com/narendramodi/status/749942812423127040
1497,749942380976103428,Manika Batra will take part in table tennis. Wishing her the very best.,,https://twitter.com/narendramodi/status/749942380976103428
1498,749941911385960449,Manavjit Singh Sandhu impressed me with his shooting skills. Good luck for Rio.,,https://twitter.com/narendramodi/status/749941911385960449
1499,749941193245679620,The determination of shooter @AyonikaPaul is appreciable. Talked to her about the Olympics &amp; wished her the best.,,https://twitter.com/narendramodi/status/749941193245679620
1500,749940870464565249,Spoke to @apurvichandela &amp; conveyed my good wishes for the games. She is a women’s 10m air rifle shooter.,,https://twitter.com/narendramodi/status/749940870464565249
1501,749939983998410752,Had the opportunity to meet the Indian contingent for the 2016 Olympics. Wished them the very best. @Rio2016_en,,https://twitter.com/narendramodi/status/749939983998410752
1502,749939247675805696,Independence Day greetings to the people of USA. A strong India-USA partnership benefits not only our two nations but also the entire world.,,https://twitter.com/narendramodi/status/749939247675805696
1503,749938910185267200,I bow to Swami Vivekananda on his Nirvan Diwas.,,https://twitter.com/narendramodi/status/749938910185267200
1504,749634961884401664,Spoke about how compassion towards poor & welfare of farmers was at the core of Baba Banda Singh Bahadur Ji’s ideals,http://nm-4.com/pe8r,https://twitter.com/narendramodi/status/749634961884401664
1505,749634552411271168,Paid tributes to the great Baba Banda Singh Bahadur Ji at the programme to mark 300th anniversary of his martyrdom.,,https://twitter.com/narendramodi/status/749634552411271168
1506,749195602869624833,My thoughts are with the bereaved families. I pray that those who are injured recover quickly.,,https://twitter.com/narendramodi/status/749195602869624833
1507,749195021518118913,India stands firmly with our sisters & brothers of Bangladesh in this hour of grief.,,https://twitter.com/narendramodi/status/749195021518118913
1508,749194462954348544,The attack in Dhaka has pained us beyond words. I spoke to PM Sheikh Hasina & strongly condemned the despicable attack.,,https://twitter.com/narendramodi/status/749194462954348544
1509,748780328219619328,I laud HAL & ADA on the induction of Tejas fighter jet. This illustrates our skills & strengths to enhance indigenous defence manufacturing.,,https://twitter.com/narendramodi/status/748780328219619328
1510,748780004490686464,Induction of indigenously made Tejas fighter jet into the Air Force fills our hearts with unparalleled pride & happiness. #TransformingIndia,,https://twitter.com/narendramodi/status/748780004490686464
1511,748747418204663809,"Excellent initiative by the Maharashtra Government, of planting 2 crore trees in one day. Urge everyone in Maharashtra to support & join.",,https://twitter.com/narendramodi/status/748747418204663809
1512,748747290571993088,"On Canada Day, greetings to the people of Canada, a valued & vital friend of India’s with whom we share a strong bilateral partnership.",,https://twitter.com/narendramodi/status/748747290571993088
1513,748746224442810368,Wishing my ministerial colleague & good friend @MVenkaiahNaidu on his birthday. I pray that he is blessed with a long &amp; healthy life.,,https://twitter.com/narendramodi/status/748746224442810368
1514,748745770904408064,"Birthday wishes to our senior leader known for his humility & years of service, @KalrajMishra ji. May he lead a long &amp; healthy life.",,https://twitter.com/narendramodi/status/748745770904408064
1515,748467914441920512,Anguished by the attack near Kabul. I condemn this mindless violence. My thoughts & prayers with the bereaved families & the injured.,,https://twitter.com/narendramodi/status/748467914441920512
1516,748423703747264512,Met @WorldBank President @JimYongKim &amp; discussed ways to deepen India’s engagement with the World Bank.,http://nm-4.com/hwyr,https://twitter.com/narendramodi/status/748423703747264512
1517,748393805330681857,Am happy that the 'Narendra Modi App' is becoming a medium that is encouraging a spirit of volunteering & teamwork particularly among youth.,,https://twitter.com/narendramodi/status/748393805330681857
1518,748393710308696064,I congratulate & appreciate the young friends for their efforts & rich ideas that emerged during the meeting.,,https://twitter.com/narendramodi/status/748393710308696064
1519,748393620378685441,"Yesterday, several youngsters got together in Delhi & discussed volunteering efforts for nation building through ‘Narendra Modi Mobile App.’",,https://twitter.com/narendramodi/status/748393620378685441
1520,748159608359886848,National Mineral Exploration Policy approved by the Cabinet will spearhead sectoral growth & accelerate development.,http://nm-4.com/8uwr,https://twitter.com/narendramodi/status/748159608359886848
1521,748159304625164288,"Reviewed progress towards installing solar pumps, which will help provide clean drinking water in remote areas. http://nm-4.com/huwr",http://nm-4.com/huwr,https://twitter.com/narendramodi/status/748159304625164288
1522,748159159229620225,The issue of preparedness for dealing with floods came up during PRAGATI session. Urged states to ensure efficacy of relief mechanisms.,,https://twitter.com/narendramodi/status/748159159229620225
1523,748158308767440896,"Today’s PRAGATI session was marked by extensive discussions on road, rail, coal projects and water conservation.",,https://twitter.com/narendramodi/status/748158308767440896
1524,747984541646655490,Attack in Istanbul is inhuman & horrific. I condemn it strongly. My thoughts are with bereaved families. May the injured recover quickly.,,https://twitter.com/narendramodi/status/747984541646655490
1525,747701912150114304,The book contains photos & a brief profile of over 250 species of birds found in the Banni area of Kutch.,,https://twitter.com/narendramodi/status/747701912150114304
1526,747701816117370881,"Based in Bhuj, GUIDE has been studying plant, bird & marine life in the Rann of Kutch for many years. http://gujaratdesertecology.com",http://gujaratdesertecology.com,https://twitter.com/narendramodi/status/747701816117370881
1527,747701550995341312,"Released ‘The Birds of Banni Grassland’, a book by scientists of Gujarat Institute of Desert Ecology (GUIDE).",,https://twitter.com/narendramodi/status/747701550995341312
1528,747613823020957697,Tributes to Shri PV Narasimha Rao on his birth anniversary. He led India at a crucial time & his leadership was both notable & vital.,,https://twitter.com/narendramodi/status/747613823020957697
1529,747439823036768256,My interview with @TimesNow. http://nm-4.com/1ntr via NMApp,http://nm-4.com/1ntr,https://twitter.com/narendramodi/status/747439823036768256
1530,747397112267169792,Does the nation want to know what I frankly shared with Mr. Arnab Goswami? Find out 6 PM onwards on @timesnow.,,https://twitter.com/narendramodi/status/747397112267169792
1531,747343054311297024,A newsletter on the news from the week gone by…grand Yoga Day celebrations & economic reforms in India. http://bit.ly/28ZVyyo,http://bit.ly/28ZVyyo,https://twitter.com/narendramodi/status/747343054311297024
1532,747078159091240960,A quick read from social media. http://www.narendramodi.in/social-media-corner-26th-june-social-media-494325 #MannKiBaat,http://www.narendramodi.in/social-media-corner-26th-june-social-media-494325,https://twitter.com/narendramodi/status/747078159091240960
1533,746976132726038528,And yes….do give a missed call on 1922 and hear #MannKiBaat in the language of your choice.,https://soundcloud.com/narendramodi/pm-modis-mann-ki-baat-june-2016,https://twitter.com/narendramodi/status/746976132726038528
1534,746976059778732032,"Are you aware of the scheme to declare your undisclosed income, if any? Spoke on it during #MannKiBaat.",,https://twitter.com/narendramodi/status/746976059778732032
