,tweet-id,tweet-text,include-links,tweet-url
2113,722082368866095104,"I am looking forward to being in Jammu & Kashmir tomorrow, where I will attend a wide range of programmes & interact with citizens.",,https://twitter.com/narendramodi/status/722082368866095104
2114,721692467632844800,"Got the opportunity to visit Swami Atmasthananda ji at the Ramakrishna Mission Seva Pratishthan, Kolkata & enquired about his health.",,https://twitter.com/narendramodi/status/721692467632844800
2115,721691884406505473,Central Govt. is doing everything possible to ensure better future for WB & ensure that youth get job opportunities. http://nm-4.com/97nm,http://nm-4.com/97nm,https://twitter.com/narendramodi/status/721691884406505473
2116,721691731154984961,What can be a greater betrayal than the fact that the same people elected to fulfil aspirations are caught on camera indulging in corruption,,https://twitter.com/narendramodi/status/721691731154984961
2117,721690744231079937,"Highlighted BJP's development agenda & why people of WB should reject AITC, Left & Congress during the large rallies today. @BJP4Bengal",,https://twitter.com/narendramodi/status/721690744231079937
2118,721569905712082944,"Leaving for WB. Will campaign in Krishnanagar, Kolkata. Do join in large numbers. You can also watch on your mobiles",http://nm4.in/dnldapp,https://twitter.com/narendramodi/status/721569905712082944
2119,721550160203898881,I hope those who are injured recover at the earliest & the damage to property & other infrastructure is minimal.@MashiRafael @JorgeGlas,,https://twitter.com/narendramodi/status/721550160203898881
2120,721549758184042496,My thoughts & prayers are with the people of Ecuador. Condolences to the families of those who lost their lives in the Earthquake.,,https://twitter.com/narendramodi/status/721549758184042496
2121,721505842340626433,What are you ideas for this month's #MannKiBaat? Would love to know. Call on 1800-11-7800 or write on Open Forum.,https://mygov.in/group-issue/share-your-ideas-mann-ki-baat-24th-april-2016/,https://twitter.com/narendramodi/status/721505842340626433
2122,721505438181658624,"As Phase II of the West Bengal polls begins, I urge all those voting today to turnout in record numbers & vote.",,https://twitter.com/narendramodi/status/721505438181658624
2123,721346415511867392,Our Government has undertaken remarkable steps for enhancing rail connectivity & ensuring quality services and safety for our citizens.,,https://twitter.com/narendramodi/status/721346415511867392
2124,721346212033667073,The Indian Railways have a central role in connecting our nation. It is truly the lifeline of our progress. @RailMinIndia @sureshpprabhu,,https://twitter.com/narendramodi/status/721346212033667073
2125,721345820289855488,Greetings to the Indian Railways family on the 163rd Foundation Day & best wishes for the 61st Railway Week. @RailMinIndia @sureshpprabhu,,https://twitter.com/narendramodi/status/721345820289855488
2126,721273647009112065,Distressed on the loss of lives & damage caused by the quake in Japan. My thoughts are with bereaved families & prayers with the injured.,,https://twitter.com/narendramodi/status/721273647009112065
2127,721166663131865088,"Wishing the Governor of UP & a leader who spent years in public life, Shri Ram Naik on his birthday. May he lead a long & healthy life.",,https://twitter.com/narendramodi/status/721166663131865088
2128,720942316945473536,"Thank you for the support. We will all create a Skilled India, which will usher in youth-led development.",https://twitter.com/sachin_rt/status/720931276442726400,https://twitter.com/narendramodi/status/720942316945473536
2129,720882792452612097,Himachal Day greetings to the people of Himachal Pradesh. I hope the state attains new heights of progress in the years to come.,,https://twitter.com/narendramodi/status/720882792452612097
2130,720774018694004738,राम नवमी के पावन अवसर पर हार्दिक शुभकामनाएं।,,https://twitter.com/narendramodi/status/720774018694004738
2131,720633481798111232,It is a matter of great pride for India that Dr. Ambedkar's birth anniversary was observed at @UN &amp; several people joined the celebrations.,,https://twitter.com/narendramodi/status/720633481798111232
2132,720633150628438016,Spoke on how eNAM increases transparency & ensures better returns for farmers. Also talked of need to view agriculture sector holistically.,,https://twitter.com/narendramodi/status/720633150628438016
2133,720633034270093312,eNAM's launch is a turning point for our agriculture sector. Farmers & consumers will gain through this initiative.,http://nm-4.com/u1fm,https://twitter.com/narendramodi/status/720633034270093312
2134,720585065747472386,"Best tribute we can give to Dr. Ambedkar is to transform our villages, which is the sole means to #TransformingIndia",http://nm-4.com/aefm,https://twitter.com/narendramodi/status/720585065747472386
2135,720584643204882434,"Be it digital connectivity or doubling farmers income, scale of our initiatives is huge & we are confident to achieve the desired results.",,https://twitter.com/narendramodi/status/720584643204882434
2136,720584502699921408,"Govt's every policy, from rural electrification, financial inclusion, social security to housing, is centred around development of villages.",,https://twitter.com/narendramodi/status/720584502699921408
2137,720584221186600960,'Gram Uday Se Bharat Uday' began with a collective determination to take this initiative to every village & make it a grand mass movement.,,https://twitter.com/narendramodi/status/720584221186600960
2138,720584081692450816,"I salute Mhow, the land where Dr. Ambedkar was born. Extremely honoured to visit his birth place.",,https://twitter.com/narendramodi/status/720584081692450816
2139,720516297390473216,"Endeavours to ensure port-led development, futuristic infrastructure & positive results seen so far.",https://amp.twimg.com/v/6d446b6c-6a1e-4783-bb8e-be8b8e9cf95a,https://twitter.com/narendramodi/status/720516297390473216
2140,720515703963521024,"This is the right time to come to India, even better to come by sea…the Indian ship is set for the long haul!",http://nm-4.com/6wem,https://twitter.com/narendramodi/status/720515703963521024
2141,720514048517869569,Dr. Ambedkar was the architect of water & river navigation policy. He saw it as a means to empower the poor.,,https://twitter.com/narendramodi/status/720514048517869569
2142,720513387453681668,Maritime India Summit showcases India's maritime history and emerging trends & opportunities in the maritime sector.,,https://twitter.com/narendramodi/status/720513387453681668
2143,720426087797248002,In the evening will launch e-trading platform for the National Agriculture Market. 21 mandis from 8 States will join the platform today.,,https://twitter.com/narendramodi/status/720426087797248002
2144,720425734041313280,"'Gram Uday Se Bharat Uday Abhiyan' is a nation wide movement to enhance Panchayati Raj, farmer welfare & rural dev.",,https://twitter.com/narendramodi/status/720425734041313280
2145,720424014292717568,Will pay my respects to Dr. Ambedkar at Mhow in MP & address a public meeting as a part of the 'Gramoday Se Bharat Uday Abhiyan.',,https://twitter.com/narendramodi/status/720424014292717568
2146,720423056825389056,Maritime India Summit brings together many nations & will be a game changer in the development of our ports & coastal infrastructure.,,https://twitter.com/narendramodi/status/720423056825389056
2147,720422660241367041,On this special day will attend programmes across India. First heading to Mumbai for the Maritime India Summit.,,https://twitter.com/narendramodi/status/720422660241367041
2148,720415750666584064,"On his Jayanti, I bow to the venerable Dr. Babasaheb Ambedkar. Jai Bhim.",,https://twitter.com/narendramodi/status/720415750666584064
2149,720243723687231488,"Met the former President of France, Mr. @NicolasSarkozy.",,https://twitter.com/narendramodi/status/720243723687231488
2150,720242688960765953,"Talked about Govt's efforts to ensure financial inclusion, crop insurance & our focus on girl child education.",http://nm-4.com/ohcm,https://twitter.com/narendramodi/status/720242688960765953
2151,720242516159692800,Met a delegation of eminent Muslims. They shared their joy on the outcomes of my Saudi Arabia visit & on Government's development agenda.,,https://twitter.com/narendramodi/status/720242516159692800
2152,720200709157875713,We in India cherish the great diversity we are blessed with. This diversity adds colour & enhances the development journey of our nation.,,https://twitter.com/narendramodi/status/720200709157875713
2153,720200589993488384,I pray that these festivals bring prosperity for our farmers & deepen the spirit of happiness & harmony in our society.,,https://twitter.com/narendramodi/status/720200589993488384
2154,720200403783151619,"Greetings to people across India on Vaisakhadi, Masadi, Bohag Bihu, Poila Boishakh, Vishu and Puthandu.",,https://twitter.com/narendramodi/status/720200403783151619
2155,720090715707940864,"On Maha Vishuba Sankranti I extend my good wishes to all Odia people. I pray for an exceptional year ahead, filled with happiness & success.",,https://twitter.com/narendramodi/status/720090715707940864
2156,720053402915352577,"Wishing my Cabinet colleague, a leader with years of experience, Dr. Najma Heptulla on her birthday. May she lead a long & healthy life.",,https://twitter.com/narendramodi/status/720053402915352577
2157,720052880900665344,Saluting all the martyrs who lost their lives in the Jallianwala Bagh massacre. Their sacrifice & courage can never be forgotten.,,https://twitter.com/narendramodi/status/720052880900665344
2158,720052194511163392,"On the auspicious occasion of Baisakhi, my greetings to people across India & the world. May this day bring joy & prosperity in society.",,https://twitter.com/narendramodi/status/720052194511163392
2159,719917349931978753,US Secretary of Defence Ashton Carter & I had fruitful deliberations on India-USA defence ties.,http://nm-4.com/vy9l,https://twitter.com/narendramodi/status/719917349931978753
2160,719875920383717376,Conservation of nature & tigers is not a drag on development. Both can happen in a complimentary manner.,https://amp.twimg.com/v/1380721f-d871-4d6f-866f-431f1fb67924,https://twitter.com/narendramodi/status/719875920383717376
2161,719875701411713032,Trafficking of body parts of tigers is a serious issue & we must collaborate at highest levels to address it.,https://amp.twimg.com/v/9116c2ed-b754-42e8-bfe1-699b4dcafb7d,https://twitter.com/narendramodi/status/719875701411713032
2162,719875388126552064,India has a long standing & successful track record of protecting tigers.,https://amp.twimg.com/v/6713ddd2-bd04-42bc-84a5-83fc627cdf01,https://twitter.com/narendramodi/status/719875388126552064
2163,719875170496876544,"Spoke on tiger conservation, a topic close to my heart. Talked about why it is no longer a choice but an imperative.",http://nm-4.com/yk9l,https://twitter.com/narendramodi/status/719875170496876544
2164,719874838597353472,Had a very good interaction with the Duke & Duchess of Cambridge. #RoyalVisitIndia @KensingtonRoyal,,https://twitter.com/narendramodi/status/719874838597353472
2165,719874262975254529,Attended the investiture ceremony & witnessed the Padma Awards being conferred. Congratulations to all the awardees for the honour.,,https://twitter.com/narendramodi/status/719874262975254529
2166,719694397948858368,"Birthday wishes to Sumitra Mahajan ji, a veteran leader, distinguished Parliamentarian & exemplary LS Speaker. Praying for her long life.",,https://twitter.com/narendramodi/status/719694397948858368
2167,719517550871244802,The Agreements signed today reflect the extensive nature of India-Maldives ties & will benefit our nations. http://nm-4.com/xc6l,http://nm-4.com/xc6l,https://twitter.com/narendramodi/status/719517550871244802
2168,719517145827250177,Talks with President Abdulla Yameen Abdul Gayoom focussed on closer India-Maldives economic & people-to-people ties.,,https://twitter.com/narendramodi/status/719517145827250177
2169,719496382869020672,Impact of FDI In Financial Progress http://www.narendramodi.in/category/infographics via NMApp,http://www.narendramodi.in/category/infographics,https://twitter.com/narendramodi/status/719496382869020672
2170,719495577327824897,Reformed Governance Mechanism http://www.narendramodi.in/category/infographics via NMApp,http://www.narendramodi.in/category/infographics,https://twitter.com/narendramodi/status/719495577327824897
2171,719401618286874624,"Inspired by Mahatma Phule's ideals, let us collectively work to create an equal & harmonious society where the role of education is pivotal.",,https://twitter.com/narendramodi/status/719401618286874624
2172,719401512271618048,"Mahatma Phule was a stalwart ahead of his time, who gave voice to the marginalised & sought to end their suffering. Tributes on his Jayanti.",,https://twitter.com/narendramodi/status/719401512271618048
2173,719339032728047616,Requesting all those voting in Assam & West Bengal today to cast their vote in large numbers.,,https://twitter.com/narendramodi/status/719339032728047616
2174,719002936521527297,I will be reaching Kerala soon to take stock of the situation arising due to the unfortunate fire tragedy in Kollam.,,https://twitter.com/narendramodi/status/719002936521527297
2175,719000464033849344,Have also asked my Cabinet colleague & Health Minister @JPNadda to immediately reach the site of the fire tragedy in Kollam.,,https://twitter.com/narendramodi/status/719000464033849344
2176,718999312311554048,Spoke to CM Oommen Chandy about the fire at a temple in Kollam. Arranging for immediate shifting of those critically injured via helicopter.,,https://twitter.com/narendramodi/status/718999312311554048
2177,718997061694136320,Fire at temple in Kollam is heart-rending & shocking beyond words. My thoughts are with families of the deceased & prayers with the injured.,,https://twitter.com/narendramodi/status/718997061694136320
2178,718847925778919425,"Soni Chaurasia, a bright youngster from Kashi has made us very proud. Congratulations to her. http://nbt.in/2xZUbZ",http://nbt.in/2xZUbZ,https://twitter.com/narendramodi/status/718847925778919425
2179,718444792821129216,"Vote BJP for good roads, education facilities, jobs, adequate medical care. Elect BJP for Assam's progress.",https://amp.twimg.com/v/6c8b57d3-e6ee-443e-a00d-60e0d928dc95,https://twitter.com/narendramodi/status/718444792821129216
2180,718443035118276609,Assam polls are not about who the next MLA will be. They are about Assam's future. India will grow when Assam grows.,http://nm-4.com/vmul,https://twitter.com/narendramodi/status/718443035118276609
2181,718442799276765184,Misgovernance in Assam has led to people facing immense difficulties. A stable @BJP4India Govt in Assam will completely transform the state.,,https://twitter.com/narendramodi/status/718442799276765184
2182,718442531835383809,People from all walks of life joined the rallies in Assam today. Happy to see so many youngsters participate.,,https://twitter.com/narendramodi/status/718442531835383809
2183,718318594753433601,"Prayed to Maa Kamakhya, for the development of our nation & the wellbeing of our citizens.",,https://twitter.com/narendramodi/status/718318594753433601
2184,718287830678650880,"After many years, on first day of Navratri, getting an opportunity to visit Kamakhya Temple & offer prayers to Maa Kamakhya. Feeling blessed",,https://twitter.com/narendramodi/status/718287830678650880
2185,718258686557351937,"Today's Assam campaign includes rallies in Raha, Rangia, Sarbhog and Guwahati. @bjpassampradesh",,https://twitter.com/narendramodi/status/718258686557351937
2186,718255377700233217,Sajibu Cheiraoba greetings to the wonderful people of Manipur. May the new year fulfil all your wishes.,,https://twitter.com/narendramodi/status/718255377700233217
2187,718253044656431104,Navreh greetings to my fellow citizens. I pray that the coming year enhances the spirit of happiness and harmony in our lives.,,https://twitter.com/narendramodi/status/718253044656431104
2188,718252480304390144,"On the special day of Ugadi, my greetings to everyone. I hope the new year brings peace & prosperity in our society.",,https://twitter.com/narendramodi/status/718252480304390144
2189,718251917693071360,"Gudi Padwa wishes to all friends in Maharashtra. Praying for a phenomenal year, full of happiness and success.",,https://twitter.com/narendramodi/status/718251917693071360
2190,718251515203469314,Wishing all my Sindhi friends on the auspicious occasion of Cheti Chand. We bow to Lord Jhulelal & seek his divine blessings.,,https://twitter.com/narendramodi/status/718251515203469314
2191,718250820274372608,Greetings to people across India celebrating the advent of the New Year. May this new year bring joy & prosperity.,,https://twitter.com/narendramodi/status/718250820274372608
2192,718097988153790464,Ally with the Left in West Bengal & criticise them in Kerala…people can see through double standards of Congress.,http://nm-4.com/iupl,https://twitter.com/narendramodi/status/718097988153790464
2193,718097750638747648,Those in power in WB snatch people's money through chit funds. We have initiated Jan Dhan Yojana to give poor bank accounts & empower them.,,https://twitter.com/narendramodi/status/718097750638747648
2194,718097576667402241,Left & AITC have done great injustice to WB's poor. BJP seeks an opportunity to serve WB & fulfil dreams & aspirations of the state's youth.,,https://twitter.com/narendramodi/status/718097576667402241
2195,718097396954226688,"Euphoric atmosphere at West Bengal rallies. People are tired of Trinamool Congress, Left & see BJP as a ray of hope.",,https://twitter.com/narendramodi/status/718097396954226688
2196,717937105041686528,"Will campaign in Madarihat, Asansol & Siliguri today & talk about BJP's development agenda for West Bengal. @BJP4Bengal",,https://twitter.com/narendramodi/status/717937105041686528
2197,717890473122115584,"During last month's #MannKiBaat, had also emphasised on why correct &amp; complete treatment can help overcome TB.",https://soundcloud.com/narendramodi/pm-modi-on-tuberculosis,https://twitter.com/narendramodi/status/717890473122115584
2198,717890245493002246,A healthy lifestyle is the best way to overcome #diabetes…an excerpt from #MannKiBaat on beating diabetes. https://soundcloud.com/narendramodi/pm-modi-on-diabetes @WHO,https://soundcloud.com/narendramodi/pm-modi-on-diabetes,https://twitter.com/narendramodi/status/717890245493002246
2199,717889957180747776,Am glad that the @MoHFW_INDIA is launching key initiatives today that will make India healthier. #WorldHealthDay,,https://twitter.com/narendramodi/status/717889957180747776
2200,717889617379205121,On #WorldHealthDay I pray that all citizens across the world are blessed with good health &amp; lead a life free from diseases &amp; ailments. @WHO,,https://twitter.com/narendramodi/status/717889617379205121
2201,717698293677957120,I recall my many interactions with Kamla Advani ji. My thoughts are with the Advani family in this hour of grief. May her soul rest in peace,,https://twitter.com/narendramodi/status/717698293677957120
2202,717698046289575936,Deeply pained & saddened by Kamla Advani ji's demise. She always inspired & motivated Karyakartas & was LK Advani ji's pillar of strength.,,https://twitter.com/narendramodi/status/717698046289575936
2203,717544801172762625,My good wishes to all BJP Karyakartas as they continue their selfless journey of catering to aspirations of people & serving society.,,https://twitter.com/narendramodi/status/717544801172762625
2204,717544634570776576,"Wherever BJP has formed Governments, they served people in an exemplary manner. BJP is proud of its industrious CMs serving in many states.",,https://twitter.com/narendramodi/status/717544634570776576
2205,717544445156036608,"From Kashmir to Kanyakumari, Kutch to Arunachal Pradesh, people have reposed faith in BJP & see BJP as a party to fulfil their dreams.",,https://twitter.com/narendramodi/status/717544445156036608
2206,717544211931791360,"Guided by love for India & determined to take India to new heights of progress, generations of Karyakartas devoted their lives to the Party.",,https://twitter.com/narendramodi/status/717544211931791360
2207,717543978288095232,"On #BJPFoundationDay, I salute crores of BJP Karyakartas who have always served the BJP with admirable vigour &amp; great dedication. @BJP4India",,https://twitter.com/narendramodi/status/717543978288095232
2208,717366218215174144,Sought a promise from the e-rickshaw beneficiaries…,https://amp.twimg.com/v/c2de86e5-7923-494b-aca0-d05bd08fadae,https://twitter.com/narendramodi/status/717366218215174144
2209,717365972881924096,Here is how 'Stand up India' is different from MUDRA…both are wonderful initiatives for #TransformingIndia.,https://amp.twimg.com/v/61868e86-3cf2-4f24-832c-1d19f901ed10,https://twitter.com/narendramodi/status/717365972881924096
2210,717365582199271424,"Ownership, empowerment & less tiring…here are some benefits of e-rickshaws.",https://amp.twimg.com/v/d67ed8ec-71a0-49d1-97b4-7d169915da58,https://twitter.com/narendramodi/status/717365582199271424
2211,717365040723075074,Appreciable efforts by @DICCIorg &amp; @MilindKamble_ to promote entrepreneurship among Dalits.,https://amp.twimg.com/v/ed95ffae-d78b-41cd-848d-eb503e2d48ba,https://twitter.com/narendramodi/status/717365040723075074
2212,717348157776986112,'Chai Pe Charcha' with beneficiaries of e-rickshaws & their families. Glad to see them so happy.,,https://twitter.com/narendramodi/status/717348157776986112
2213,717347860354699264,On board the e-rickshaw…these e-rickshaws will transform the lives of several people. #TransformingIndia,,https://twitter.com/narendramodi/status/717347860354699264
2214,717347303359524864,Our faith is in the people of India. Their skills will take India to newer heights of progress.,,https://twitter.com/narendramodi/status/717347303359524864
2215,717346234386657280,'Stand up India' seeks to empower the poor & the marginalised and make them self-sufficient & self-reliant. http://n-m4.in/1RBM377,http://n-m4.in/1RBM377,https://twitter.com/narendramodi/status/717346234386657280
2216,717345242282795009,Met our young diplomats…officer trainees of the IFS.,,https://twitter.com/narendramodi/status/717345242282795009
2217,717169219230523392,"Will also flag-off 5100 e-rickshaws under MUDRA Yojana & interact with beneficiaries, besides inaugurating a Kaushal Vikas Kendra in Noida.",,https://twitter.com/narendramodi/status/717169219230523392
2218,717168977055653889,"Today the 'Stand up India' initiative will be launched. This initiative will promote entrepreneurship among women, SC & ST communities.",,https://twitter.com/narendramodi/status/717168977055653889
2219,717168455800098816,"On his birth anniversary, tributes to the stalwart who dedicated his life to the upliftment of the poor & marginalised, Babu Jagjivan Ram.",,https://twitter.com/narendramodi/status/717168455800098816
2220,716893298590240768,May the new Government of J&K leave no stone unturned in fulfilling dreams & aspirations of the people & take J&K to new heights of progress,,https://twitter.com/narendramodi/status/716893298590240768
2221,716893136073527298,"Congratulations & best wishes to Ms. Mehbooba Mufti, Dr. Nirmal Singh & all those who took oath today.",,https://twitter.com/narendramodi/status/716893136073527298
2222,716805346090622976,Urging all those voting in West Bengal & Assam today to vote in large numbers. Young friends in particular must exercise their franchise.,,https://twitter.com/narendramodi/status/716805346090622976
2223,716653433818746881,"Thank you Saudi Arabia. Joined several programmes during my visit, which will deepen economic & people-to-people ties between our nations.",,https://twitter.com/narendramodi/status/716653433818746881
2224,716653155333738500,شكرا لك يا للمملكة العربية السعودية! خلال زيارتي، شاركت برامج عديدة وهي سوف تعزز العلاقات الاقتصادية وتواصل الشعبين بين بلدينا.,,https://twitter.com/narendramodi/status/716653155333738500
2225,716651774887628800,Great interaction with HM King Salman bin Abdulaziz Al Saud. We are committed to stronger India-Saudi Arabia ties.,,https://twitter.com/narendramodi/status/716651774887628800
2226,716650467841814528,"A Chera King, a visit to Mecca & a mosque in Thrissur…seeing India-Saudi Arabia ties through my gift to King Salman. http://n-m4.in/1MLcBmd",http://n-m4.in/1MLcBmd,https://twitter.com/narendramodi/status/716650467841814528
2227,716634272619036672,The Saudi Government has agreed to look at the cases sympathetically & constitute a review mechanism with immediate effect.,,https://twitter.com/narendramodi/status/716634272619036672
2228,716634131149365248,Took up with His Majesty the cases of Indians who are serving sentences for minor offences.,,https://twitter.com/narendramodi/status/716634131149365248
2229,716574268331397120,Delighted to meet HE @AdelAljubeir &amp; exchange thoughts on a wide range of bilateral issues.,,https://twitter.com/narendramodi/status/716574268331397120
2230,716573534340849664,"HE Khalid A. Al-Falih & I had a productive meeting, discussing ways to increase India-Saudi Arabia cooperation.",,https://twitter.com/narendramodi/status/716573534340849664
2231,716572259180085248,"Powered by Nari Shakti…admirable dedication, determination & dynamism at the TCS Center in Riyadh.",,https://twitter.com/narendramodi/status/716572259180085248
2232,716571320176119808,Emphasised on the tremendous scope for investing in manufacturing medical devices & great potential for medical tourism that India offers.,,https://twitter.com/narendramodi/status/716571320176119808
