,tweet-id,tweet-text,include-links,tweet-url
0,814866127264317446,"Shri Balasaheb Vikhe Patil was a mass leader whose work in agriculture, rural development, education & cooperatives will be remembered.",,https://twitter.com/narendramodi/status/814866127264317446
1,814865990794248197,Pained by the demise of Shri Balasaheb Vikhe Patil. May his soul rest in peace. My condolences to @RVikhePatil &amp; the entire family.,,https://twitter.com/narendramodi/status/814865990794248197
2,814853246988611586,"Download BHIM (Bharat Interface for Money) App. It will improve ease, experience & efficiency of digital transfers. https://play.google.com/store/apps/details?id=in.org.npci.upiapp",https://play.google.com/store/apps/details?id=in.org.npci.upiapp,https://twitter.com/narendramodi/status/814853246988611586
3,814851532722028544,3 years ago the dominant theme in the news was how much money was lost in scams. Now its about what is coming back. This is the difference.,,https://twitter.com/narendramodi/status/814851532722028544
4,814851435737149444,"अब वक्त बदल चुका है...आप ही का अंगूठा आपका बैंक, आपकी पहचान, आपका कारोबार!",,https://twitter.com/narendramodi/status/814851435737149444
5,814851261308669952,The most severe effect of corruption & black money is on the aspirations of the poor. A corruption free India is the best gift for our poor.,,https://twitter.com/narendramodi/status/814851261308669952
6,814851016826830848,"Honoured youngsters, entrepreneurs based in villages & collectors who are adding strong support in the movement towards digital transactions",,https://twitter.com/narendramodi/status/814851016826830848
7,814850409177067520,"The App's name is inspired by Dr. Babasaheb Ambedkar, at the core of whose vision was empowerment of the poor & a focus on self-reliance.",,https://twitter.com/narendramodi/status/814850409177067520
8,814850266969186304,The launch of the BHIM App is a landmark moment in our journey to move towards digital transactions & eliminate the menace of corruption.,,https://twitter.com/narendramodi/status/814850266969186304
9,814849431249924096,Vibrancy at Delhi's #DigiDhanMela showed yet again how strongly India has joined the movement to end corruption.,http://nm-4.com/kn0z,https://twitter.com/narendramodi/status/814849431249924096
10,814760389271392258,I will launch a Mobile App which will enable easier digital payments & transactions. The App will immensely benefit our citizens.,,https://twitter.com/narendramodi/status/814760389271392258
11,814760217112035330,Will join #DigiDhanMela programme at Talkatora Stadium in Delhi &amp; extend support to the movement towards increased digital transactions.,,https://twitter.com/narendramodi/status/814760217112035330
12,814719249075683328,Jharkhand Government & Minister @PiyushGoyal are working to restore normalcy. @NDRFHQ has been engaged for rescue &amp; relief operations.,,https://twitter.com/narendramodi/status/814719249075683328
13,814718992812150784,Saddened by the loss of lives at a mine in Jharkhand. My prayers are with those trapped inside. Spoke to CM Raghubar Das on the situation.,,https://twitter.com/narendramodi/status/814718992812150784
14,814463981318344704,Had a very insightful discussion with @SadhguruJV. @ishafoundation,,https://twitter.com/narendramodi/status/814463981318344704
15,814463405574623239,"Movement towards digital transactions spells the end of corruption, which adversely affects dreams & aspirations of the poor & middle class.",,https://twitter.com/narendramodi/status/814463405574623239
16,814463159700361216,I thank the people of Dehradun for making today's #DigiDhanMela in Dehradun a resounding success. People from all walks of life took part.,,https://twitter.com/narendramodi/status/814463159700361216
17,814294008268603393,Sharing a newsletter that includes snippets from last Sunday's #MannKiBaat. http://bit.ly/2id5mqi,http://bit.ly/2id5mqi,https://twitter.com/narendramodi/status/814294008268603393
18,814092338645434368,India has taken up the movement to embrace digital transactions with unprecedented vigour. My gratitude to people of India. #DigiDhanMela,,https://twitter.com/narendramodi/status/814092338645434368
19,814092231397117953,Every #DigiDhanMela is a fine way of learning about digital payments &amp; even inspiring others to use digital means.,,https://twitter.com/narendramodi/status/814092231397117953
20,814092133632069632,"Today's #DigiDhanMela in Goa saw widescale participation. Colleagues @manoharparrikar, Shri Shripad Naik &amp; CM Parsekar also took part.",,https://twitter.com/narendramodi/status/814092133632069632
21,814078008378068992,Paid tributes to Shri Sunder Lal Patwa in Bhopal.,,https://twitter.com/narendramodi/status/814078008378068992
22,813986589659410432,Shri Sunder Lal Patwa strengthened the BJP & was always admired by Karyakartas. My thoughts are with his family. May his soul rest in peace.,,https://twitter.com/narendramodi/status/813986589659410432
23,813986462995607552,Saddened on the passing away of Shri Sunder Lal Patwa. He was a hardworking & dedicated leader whose good work as MP CM will be remembered.,,https://twitter.com/narendramodi/status/813986462995607552
24,813750988465053696,उत्तराखंड का मिज़ाज साफ है... राज्य विकास चाहता है। भाजपा 'उत्तम उत्तराखंड' के लिए प्रतिबद्ध है।,http://nm-4.com/o9zz,https://twitter.com/narendramodi/status/813750988465053696
25,813750928226459648,हमारा संकल्प है गरीबों को ताकत देना। मैं 125 करोड़ भारतीयों का आभारी हूंकि उन्होंने भ्रष्टाचार को मिटाने के सफाई अभियान में मजबूत साथ दिया।,,https://twitter.com/narendramodi/status/813750928226459648
26,813750623074066432,देवभूमि और वीरभूमि उत्तराखंड के लोगों का आभार कि उन्होंने भारी संख्या में परिवर्तन रैली में हिस्सा लिया।,,https://twitter.com/narendramodi/status/813750623074066432
27,813750177949302785,चारधाम महामार्ग परियोजना का शिलान्यास किया। इस परियोजना से पर्यटन एवं रोजगार को बढ़ावा मिलेगा।,,https://twitter.com/narendramodi/status/813750177949302785
28,813749792241135616,The various #DigiDhanMela's have generated immense enthusiasm &amp; awareness on need &amp; methods of digital payments.,,https://twitter.com/narendramodi/status/813749792241135616
29,813749730794606592,"Ludhiana hosted the #DigiDhanMela, where several people came and extended support to the movement towards increased cashless transactions.",,https://twitter.com/narendramodi/status/813749730794606592
30,813749390254882816,Had a fruitful interaction with various economists on a wide range of policy issues. http://nm-4.com/8a0z,http://nm-4.com/8a0z,https://twitter.com/narendramodi/status/813749390254882816
31,813592405983182848,"During my Uttarakhand visit, will also address a public meeting in Dehradun.",,https://twitter.com/narendramodi/status/813592405983182848
32,813592249996951552,"Adding of bypasses, tunnels, bridges & flyovers will ease travel. Proper slope stabilisation will ensure protection against landslides.",,https://twitter.com/narendramodi/status/813592249996951552
33,813591939312291840,Char Dham highway project will lead to creation of over 900 km of roads. Connectivity & tourism will get a strong boost through the project.,,https://twitter.com/narendramodi/status/813591939312291840
34,813591609430290432,"Will visit Devbhoomi Uttarakhand today for the inauguration of a key infrastructure project, the Char Dham highway development programme.",,https://twitter.com/narendramodi/status/813591609430290432
35,813591176909504512,"Here is a newsletter covering my visits to Kanpur & Kashi, passage of a Bill that empowers Divyang citizens & more. http://bit.ly/2hggUas",http://bit.ly/2hggUas,https://twitter.com/narendramodi/status/813591176909504512
36,813370918361665536,Pay digitally and you could be a lucky winner of the thousands of prizes that are going to be awarded over a period of 100 days!,,https://twitter.com/narendramodi/status/813370918361665536
37,813370542875033600,"Congrats to these youngsters. Youth are agents of change, who must take a lead in inspiring others to pay digitally.",https://twitter.com/NITIAayog/status/813337201392029697,https://twitter.com/narendramodi/status/813370542875033600
38,813370359361638401,I thank well-known sportsperson @DuttYogi. His message of increased digital payments is vital.,https://twitter.com/NITIAayog/status/813331445477314560,https://twitter.com/narendramodi/status/813370359361638401
39,813370122018570240,"Great enthusiasm at the #DigiDhanMela in Gurugram, where CM @mlkhattar, Ministers &amp; others lent support to increased digital transactions.",,https://twitter.com/narendramodi/status/813370122018570240
40,813304895151312897,The successful test firing of Agni V is the result of the hardwork of DRDO & its scientists. I congratulate them. @DRDO_India,,https://twitter.com/narendramodi/status/813304895151312897
41,813304698367156224,Successful test firing of Agni V makes every Indian very proud. It will add tremendous strength to our strategic defence.,,https://twitter.com/narendramodi/status/813304698367156224
42,813015426711982080,Talked at length about Lucky Grahak Yojana & Digidhan Vyapar Yojana during today's #MannKiBaat.,https://soundcloud.com/narendramodi/we-have-launched-lucky-grahak-yojana-and-digidhan-yojana-to-boost-cashless-transactions,https://twitter.com/narendramodi/status/813015426711982080
43,813015305182027776,I call upon people of India to embrace digital transactions and participate in Lucky Grahak Yojana & Digidhan Vyapar Yojana in large numbers,,https://twitter.com/narendramodi/status/813015305182027776
44,813015158062653440,"In the coming days, there will be programmes all over India & the thousands of winners of the two initiatives will be awarded.",,https://twitter.com/narendramodi/status/813015158062653440
45,813014974398218240,I thank @DeepaAthlete &amp; @GautamGambhir for inspiring others &amp; extending support to the movement towards increased digital transactions.,,https://twitter.com/narendramodi/status/813014974398218240
46,813014748241469442,"First 15,000 winners of Lucky Grahak Yojana & Digidhan Vyapar Yojana were announced at a vibrant programme in Delhi. Congrats to the winners",,https://twitter.com/narendramodi/status/813014748241469442
47,812997695010848768,India joins Russia in mourning the tragic loss of lives of Russian servicemen in the air crash today.,,https://twitter.com/narendramodi/status/812997695010848768
48,812952558306140161,It is a well established fact that India is a bright spot in the world economy. #MannKiBaat,https://soundcloud.com/narendramodi/because-of-the-constant,https://twitter.com/narendramodi/status/812952558306140161
49,812952409961992192,"In the past few weeks, our sportspersons have made us very proud. Congratulated them in today's #MannKiBaat.",https://soundcloud.com/narendramodi/sports,https://twitter.com/narendramodi/status/812952409961992192
50,812952039944658944,Talked about passage of Rights of Persons with Disabilities Bill & how it empowers our Divyang sisters & brothers.,https://soundcloud.com/narendramodi/we-are-committed-to-uplifting,https://twitter.com/narendramodi/status/812952039944658944
51,812951780237508609,"Spoke on incentives for cashless transactions, people's support for the fight against corruption & more #MannKiBaat.",https://soundcloud.com/narendramodi/pm-modis-mann-ki-baat-december-2016,https://twitter.com/narendramodi/status/812951780237508609
52,812903287586336769,"Just after the Hindi version, you can hear #MannKiBaat in your regional languages. Tune in.",,https://twitter.com/narendramodi/status/812903287586336769
53,812889418939801600,Went to Atal ji's residence to greet him.,,https://twitter.com/narendramodi/status/812889418939801600
54,812839791125413888,The final #MannKiBaat of 2016 will take place at 11 AM today. Do join.,,https://twitter.com/narendramodi/status/812839791125413888
55,812837696783552513,Birthday wishes to Pakistan PM Mr. Nawaz Sharif. I pray for his long and healthy life.,,https://twitter.com/narendramodi/status/812837696783552513
56,812836748644392960,"See what Atal ji does when he meets a party Karyakarta. This simplicity and warmth of Atal ji we all cherish,",,https://twitter.com/narendramodi/status/812836748644392960
57,812834842530324481,Atal ji's exemplary service & leadership has had a very positive impact on India's growth trajectory. His great personality is endearing.,,https://twitter.com/narendramodi/status/812834842530324481
58,812834626519506944,Wishing our most beloved & widely respected Atal ji a happy birthday. I pray that he is blessed with good health and a long life.,,https://twitter.com/narendramodi/status/812834626519506944
59,812834345421414400,I bow to Mahamana Pt. Madan Mohan Malaviya on his Jayanti. He has left an indelible contribution in the history of India.,,https://twitter.com/narendramodi/status/812834345421414400
60,812833667223429120,"Merry Christmas! We remember & celebrate the life & teachings of Jesus Christ. His message of peace, unity & compassion inspires us all.",,https://twitter.com/narendramodi/status/812833667223429120
61,812677970552721409,Spoke about how our decision on 500 & 1000 Rupee notes helped civic bodies & urged people of Pune to embrace digital transactions.,,https://twitter.com/narendramodi/status/812677970552721409
62,812677902676303873,Central Government is approaching urbanisation with a long term & futuristic vision with a strong emphasis on timely completion of projects.,,https://twitter.com/narendramodi/status/812677902676303873
63,812677741141106688,"Increased urbanisation brings challenges, which must be addressed so that we can create top quality urban centres with good infrastructure.",,https://twitter.com/narendramodi/status/812677741141106688
64,812677657154326528,Pune Metro was a longstanding dream of the people of Pune. Glad that the Bhumipujan of the project was performed. http://nm-4.com/e0zz,http://nm-4.com/e0zz,https://twitter.com/narendramodi/status/812677657154326528
65,812631363748696064,Performed Jalpujan of #ShivSmarak.,,https://twitter.com/narendramodi/status/812631363748696064
66,812630901926465536,The development projects whose foundation stones were laid today are going to have a transformative impact on Mumbai's infrastructure.,,https://twitter.com/narendramodi/status/812630901926465536
67,812630111031656448,Addressed a massive public meeting in Mumbai. Here is my speech. http://nm-4.com/9yzz,http://nm-4.com/9yzz,https://twitter.com/narendramodi/status/812630111031656448
68,812579463279935489,World class securities & commodity markets are key to India's growth. Let us make our financial markets more relevant to this new era.,,https://twitter.com/narendramodi/status/812579463279935489
69,812579231855017984,Markets should provide benefits to farmers. SEBI should work for closer linkage between e-NAM & derivatives markets to help farmers.,,https://twitter.com/narendramodi/status/812579231855017984
70,812579121326755840,Financial markets must help raise capital for productive purposes & their beneficiaries must fairly contribute to nation-building via taxes.,,https://twitter.com/narendramodi/status/812579121326755840
71,812579010416783360,GoI is committed to following sound & prudent economic policies to ensure that India continues to have a bright future in the long run.,,https://twitter.com/narendramodi/status/812579010416783360
72,812578702630359040,"Spoke on India's economic transformation, role of financial markets & more at inauguration of new NISM campus. http://nm-4.com/myzz",http://nm-4.com/myzz,https://twitter.com/narendramodi/status/812578702630359040
73,812543424402292736,"Birthday greetings to @KarzaiH, a strong votary of India-Afghanistan friendship &amp; a leader I worked closely with. I pray for his long life.",,https://twitter.com/narendramodi/status/812543424402292736
74,812510934878957568,"Chhatrapati Shivaji Maharaj is a torchbearer of courage, bravery & good governance. #ShivSmarak is a fitting tribute to him &amp; his greatness.",,https://twitter.com/narendramodi/status/812510934878957568
75,812510595148746752,I am honoured to be getting the opportunity to perform the Bhoomipujan of #ShivSmarak.,,https://twitter.com/narendramodi/status/812510595148746752
76,812509894225993729,I will be in Pune to lay the foundation stone of Pune Metro Project's Phase-1. This project will bring lot of benefits to people of Pune.,,https://twitter.com/narendramodi/status/812509894225993729
77,812509603887886337,"In Mumbai, will lay foundation stone of 2 metro corridors, Mumbai Trans Harbour Link, Phase 3 of Urban Transport Project & road projects.",,https://twitter.com/narendramodi/status/812509603887886337
78,812509111677960192,Today I will be attending programmes in Maharashtra. This includes inauguration of new campus of National Institute of Securities Markets.,,https://twitter.com/narendramodi/status/812509111677960192
79,812273496625512448,I thank the delegation of Rashtriya Isai Mahasangh for their Christmas greetings.,,https://twitter.com/narendramodi/status/812273496625512448
80,811868479292702721,कभी सोचा नहीं था कि राजनीतिक स्वार्थ के लिए कुछ लोग हिम्मत के साथ बेईमानों के साथ भी खड़े हो जाएंगे।,,https://twitter.com/narendramodi/status/811868479292702721
81,811868272903659520,किसी का काला धन खुल रहा है तो किसी का काला मन।,,https://twitter.com/narendramodi/status/811868272903659520
82,811868110248493056,We are bringing top class infrastructure that will give wings to Kashi's development & fulfil aspirations of youth.,http://nm-4.com/9qzz,https://twitter.com/narendramodi/status/811868110248493056
83,811867847789973504,With my young friends in Varanasi.,,https://twitter.com/narendramodi/status/811867847789973504
84,811867141481730048,Spent time with booth level Karyakartas. Their energy and enthusiasm to serve society is gladdening. @BJP4India,,https://twitter.com/narendramodi/status/811867141481730048
85,811866556988682240,"With beneficiaries of various Government schemes. Our Government is constantly and tirelessly working for the poor, middle class & youth.",,https://twitter.com/narendramodi/status/811866556988682240
86,811866008256286720,Some pictures from my Varanasi visit.,,https://twitter.com/narendramodi/status/811866008256286720
87,811865693188542464,It is always special to be in Kashi.,,https://twitter.com/narendramodi/status/811865693188542464
88,811770665267175424,There will also be an interaction with booth level @BJP4India Karyakartas working in the Varanasi Lok Sabha seat. @BJP4UP,,https://twitter.com/narendramodi/status/811770665267175424
89,811770331547340801,Foundation stone for a ESI super speciality hospital will also be laid. All these development works will greatly benefit people of Varanasi.,,https://twitter.com/narendramodi/status/811770331547340801
90,811770127112806400,Will inaugurate a Trade Facilitation Centre & Crafts Museum and launch schemes & programmes of @TexMinIndia during the Varanasi visit.,,https://twitter.com/narendramodi/status/811770127112806400
91,811769921805746176,Will lay the foundation stone for Mahamana Pt. Madan Mohan Malviya Cancer Centre & Centenary Super Speciality Hospital.,,https://twitter.com/narendramodi/status/811769921805746176
92,811769682571051008,Looking forward to visiting Varanasi & interacting with citizens. I will be joining various programmes during my visit today.,,https://twitter.com/narendramodi/status/811769682571051008
93,811175158270423040,"President Atambayev and I agreed on furthering economic ties, including trade linkages between our nations.",http://nm-4.com/okzz,https://twitter.com/narendramodi/status/811175158270423040
94,811174805533622273,"Kyrgyz Republic is a valuable partner in our common pursuit of making Central Asia a region of sustainable peace, stability and prosperity.",,https://twitter.com/narendramodi/status/811174805533622273
95,811174667402649600,President Almazbek Atambayev & I held extensive discussions on the full range of ties between India & and the Kyrgyz Republic.,,https://twitter.com/narendramodi/status/811174667402649600
96,811154891905318913,Congratulations to BJP & Akali Dal Karyakartas for working with remarkable determination on the ground and serving people. @BJP4Chandigarh,,https://twitter.com/narendramodi/status/811154891905318913
97,811154674451644416,Thank you to the people of Chandigarh for supporting @BJP4India &amp; @Akali_Dal_. This shows the importance people attach to good governance.,,https://twitter.com/narendramodi/status/811154674451644416
98,810851015603945472,"यूपी में परिवर्तन की आँधी साफ नजर आ रही है। यहाँ भ्रष्टाचार, गुंडाराज नहीं बल्कि विकास के लिए समर्पित सरकार चाहिए।",http://nm-4.com/rgzz,https://twitter.com/narendramodi/status/810851015603945472
99,810850740621246464,केन्द्र में ऐसी सरकार है जो ईमानदारी के रास्ते पर आगे चल रही है। गरीबों-पिछड़ों और देश के विकास के लिए काम कर रही है।,,https://twitter.com/narendramodi/status/810850740621246464
100,810850586681896960,"एक तरफ हमारा संकल्प भ्रष्टाचार व काले धन को बंद करना है, वहीं कांग्रेस संसद बंद करने और महत्वपूर्ण मुद्दों को भटकाने का प्रयास कर रही है।",,https://twitter.com/narendramodi/status/810850586681896960
101,810849631299076096,कानपुर के लोगों का बहुत-बहुत आभार कि उन्होंने परिवर्तन रैली में भारी संख्या में भाग लिया। @BJP4UP,,https://twitter.com/narendramodi/status/810849631299076096
102,810848556911394818,"In Kanpur, visited Kaushal Pradarshani, an exhibition showcasing opportunities in skill development for our youth.",,https://twitter.com/narendramodi/status/810848556911394818
103,810810333031960576,Congratulations on the historic triple century @karun126! We all are delighted &amp; proud of your remarkable feat.,,https://twitter.com/narendramodi/status/810810333031960576
104,810541585549131776,The #JuniorHockeyWorldCup win augurs well for the future of Indian hockey &amp; will make the sport even more popular among youngsters.,,https://twitter.com/narendramodi/status/810541585549131776
105,810541267973193728,Extremely proud of our youngsters! Congratulations to our junior hockey team for winning the #JuniorHockeyWorldCup.,,https://twitter.com/narendramodi/status/810541267973193728
106,810348062434586624,"There is a separate section on Mobile App dedicated to inputs for #MannKiBaat, to be held on 25th. Do contribute.",http://nm4.in/dnldapp,https://twitter.com/narendramodi/status/810348062434586624
107,810336885126021120,Call on 1800-11-7800 & share your ideas for forthcoming #MannKiBaat. You can also write on the MyGov Open Forum.,https://www.mygov.in/group-issue/inviting-ideas-pm-narendra-modis-mann-ki-baat-december-2016/,https://twitter.com/narendramodi/status/810336885126021120
108,810101573758189569,"President Rahmon & I saw immense scope in boosting ties in hydropower, IT, health & pharmaceuticals sectors. http://www.pmindia.gov.in/en/news_updates/press-statement-by-prime-minister-during-the-state-visit-of-president-of-tajikistan-to-india/?comment=disable",http://www.pmindia.gov.in/en/news_updates/press-statement-by-prime-minister-during-the-state-visit-of-president-of-tajikistan-to-india/?comment=disable,https://twitter.com/narendramodi/status/810101573758189569
109,810101354542878720,"Our talks also included discussions on combating terrorism, which has cast a long shadow of violence and instability over the entire region.",,https://twitter.com/narendramodi/status/810101354542878720
110,810101162267602944,President Emomali Rahmon & I held talks on strengthening India-Tajikistan relations. We also shared views on developments in our region.,,https://twitter.com/narendramodi/status/810101162267602944
111,809965454118686720,इस क्रिसमस से कैशलेस लेन-देन पर पाएं ढेरों उपहार।,,https://twitter.com/narendramodi/status/809965454118686720
112,809768333654388736,"The new Act has several salient features which will enhance opportunity, equality & accessibility. Have a look.",http://nm-4.com/gazz,https://twitter.com/narendramodi/status/809768333654388736
